{
  "linked_verification": {
    "path": "out/verification_score/verification_score.json",
    "sha256": "87a9c3ccf1f74abcdc4acfc0f53af04f82f46099c45fef1c3169e674d625f693"
  },
  "previous_review_sha256": "GENESIS",
  "review_comment": "Stage271 bootstrap record linked to Stage270 verification artifact.",
  "review_id": "ef456eb29c3627e1",
  "review_result": "comment",
  "reviewer": {
    "contact": "pending",
    "display_name": "External Reviewer Placeholder",
    "id": "self-demo-reviewer",
    "type": "local_external_placeholder"
  },
  "stage": "stage271",
  "target_artifact": "out/verification_score/verification_score.json",
  "timestamp_utc": "2026-04-15T03:34:00Z",
  "version": "1"
}
